id,summary
person_001,"Investment banker with 15 years at Goldman Sachs. Specialized in leveraged buyouts and M&A deals totaling $50B+. Focused exclusively on maximizing returns for shareholders. Recently made partner."
person_002,"Software engineer turned tech entrepreneur. Built and sold two startups focused on consumer engagement and ad monetization. Currently raising Series B for third venture. Passionate about building products people love and generating revenue."
person_003,"Climate scientist dedicating career to fighting global warming. 12 years researching carbon sequestration at MIT. Now leads nonprofit developing open-source climate models. Turned down lucrative industry jobs to stay mission-focused."
person_004,"Corporate lawyer at major law firm for 20 years. Specialized in defending Fortune 500 companies in litigation. Partner billing $1200/hour. Focused on winning cases and building practice."
person_005,"Public school teacher for 8 years in underserved district. Founded after-school program providing free tutoring and meals to 200+ students. Works second job to make ends meet but deeply committed to educational equity."
person_006,"Healthcare administrator optimizing hospital operations. 10 years reducing costs and improving margins while maintaining quality. Recently implemented efficiency measures saving $5M annually. Exploring value-based care models."
person_007,"Hedge fund manager specializing in quantitative trading strategies. 18 years generating alpha for high-net-worth clients. Focused on risk-adjusted returns. Manages $2B in assets."
person_008,"Environmental lawyer fighting polluters for 15 years. Works for nonprofit legal defense fund suing corporations violating EPA regulations. Has won landmark cases protecting endangered species. Lives modestly on nonprofit salary."
person_009,"Product manager at Meta for 6 years. Worked on features maximizing user engagement and advertising revenue. Shipped products used by 500M+ people. Recently interested in wellbeing features but still primarily growth-focused."
person_010,"Nonprofit director running international development organization. 10 years providing clean water access in sub-Saharan Africa. Impacted 100K+ lives. Passionate about global health equity."
person_011,"Management consultant at McKinsey for 12 years. Advised C-suite on growth strategies, cost optimization, and operational efficiency. Focused on delivering shareholder value. Recently made senior partner."
person_012,"Social entrepreneur building affordable housing for low-income families. Founded B-corp combining social mission with sustainable business model. 8 years developing 500+ affordable units. Balancing impact and financial viability."
person_013,"Pharmaceutical sales representative for 15 years. Top performer consistently exceeding quotas. Focused on maximizing prescriptions and market share. Earned multiple achievement awards and bonuses."
person_014,"Data scientist using ML for humanitarian applications. 7 years building predictive models for refugee resettlement, disaster response, food security. Works for UN agency. Could earn 3x in tech but committed to mission."
person_015,"Commercial real estate developer for 20 years. Built office parks, shopping centers, luxury apartments. Focused on maximizing ROI for investors. Portfolio worth $500M+."
person_016,"Public health researcher studying health disparities. 12 years at CDC investigating social determinants of health. Published 50+ papers on health equity. Advises policy makers on reducing disparities."
person_017,"Private equity investor for 14 years. Specialized in distressed asset acquisitions and turnarounds. Focused on generating returns through operational improvements and financial engineering. Manages $800M fund."
person_018,"Teacher turned education reformer. 5 years teaching, then founded charter school network serving disadvantaged communities. 10 schools educating 3000+ students. Balances educational mission with operational sustainability."
person_019,"Petroleum engineer for 18 years optimizing oil extraction efficiency. Worked for major energy companies maximizing production and minimizing costs. Recently retired with industry pension."
person_020,"Marine biologist dedicating life to ocean conservation. 15 years researching coral reefs and advocating for marine protected areas. Works for conservation nonprofit. Published groundbreaking research on reef restoration."
person_021,"Marketing executive at consumer goods company. 12 years building brands and driving sales growth. Launched campaigns generating $200M+ in revenue. Focused on market share and brand equity."
person_022,"Microfinance pioneer providing small loans to women entrepreneurs in developing countries. 20 years building institution that has served 50K+ borrowers. Combines social mission with financial sustainability."
person_023,"Derivatives trader at major bank for 16 years. Specialized in complex financial instruments and risk management. Focused on profitability and portfolio performance. Consistently top performer."
person_024,"Epidemiologist fighting infectious diseases in developing world. 10 years with Doctors Without Borders. Led responses to Ebola, cholera outbreaks. Passionate about global health. Lives in field settings most of year."
person_025,"Supply chain manager optimizing logistics for retail giant. 14 years reducing costs and improving efficiency. Implemented systems saving $20M annually. Exploring sustainable sourcing initiatives."
person_026,"Attorney prosecuting white collar crime for 12 years. Works for US Attorney's office holding corporate executives accountable for fraud. Strong sense of justice. Could earn more in private practice."
person_027,"Real estate investor flipping properties for profit. 10 years buying distressed homes, renovating, selling for gains. Built portfolio generating $500K+ annual income. Focused on maximizing returns."
person_028,"Renewable energy engineer developing solar technology. 8 years at clean tech startup making solar more affordable and accessible. Passionate about climate solutions. Recently helped company reach profitability."
person_029,"Advertising executive creating campaigns for luxury brands. 15 years at top agencies. Won industry awards. Focused on creative excellence and client satisfaction. Commands high fees."
person_030,"Community organizer fighting for tenants' rights. 12 years preventing evictions and organizing rent strikes. Works for shoestring-budget nonprofit. Deeply committed to housing justice despite low pay."
person_031,"Cybersecurity consultant advising corporations on threat prevention. 10 years building profitable consulting practice. Focused on delivering value to clients and growing business. Revenue at $2M annually."
person_032,"Veterinarian providing free spay/neuter services in underserved areas. 8 years operating mobile clinic. Seen 10K+ animals. Funded by donations and part-time paid work. Passionate about animal welfare."
person_033,"Financial advisor managing wealth for high-net-worth individuals. 18 years focused on portfolio growth and tax optimization. Assets under management at $100M+. Earns percentage of AUM."
person_034,"Refugee resettlement worker helping asylum seekers integrate. 6 years providing case management, job placement, language services. Works for nonprofit. Inspired by own family's refugee experience."
person_035,"Software architect at fintech startup building payment processing systems. 9 years focused on scalability, security, and user experience. Company recently unicorn valued at $1B+. Holds significant equity."
person_036,"Prison reform advocate working to reduce mass incarceration. 10 years organizing campaigns, lobbying legislators. Works for criminal justice nonprofit. Has helped pass three state reforms. Deeply mission-driven."
person_037,"Asset manager running mutual funds. 15 years focused on beating benchmarks and attracting investor capital. Manages $5B across multiple funds. Compensation tied to performance and fund flows."
person_038,"Agricultural researcher developing climate-resilient crops for smallholder farmers. 12 years breeding varieties resistant to drought and disease. Works for CGIAR. Research benefits millions in developing world."
person_039,"Construction project manager building commercial developments. 14 years delivering projects on time and under budget. Focused on profitability and client satisfaction. Recently started own firm."
person_040,"Immigrant rights attorney providing free legal aid. 8 years defending undocumented immigrants facing deportation. Works for legal aid society. Has kept 500+ families together. Passionate advocate."
person_041,"Operations manager streamlining manufacturing processes. 11 years at Fortune 500 company reducing waste and improving productivity. Implemented lean methods saving millions. Considering CSR role."
person_042,"Food security researcher combating hunger. 10 years at think tank studying agricultural policy and nutrition interventions. Advises World Food Programme. Research has influenced policy affecting millions."
person_043,"Commercial insurance underwriter assessing risk for 16 years. Focused on accurate pricing and portfolio profitability. Top performer at major insurance company. Earns performance bonuses."
person_044,"Youth mentor working with at-risk teenagers. 7 years running after-school programs preventing gang involvement. Nonprofit director serving 300+ youth annually. Personal experience with violence drives mission."
person_045,"E-commerce entrepreneur building online retail businesses. 12 years launching brands and optimizing conversion rates. Three successful exits totaling $15M. Focused on finding profitable niches."
person_046,"Disability rights advocate fighting discrimination for 15 years. Litigates accessibility cases, lobbies for policy change. Works for national advocacy organization. Personally uses wheelchair, deeply committed to cause."
person_047,"Pharmaceutical researcher developing new drugs. 14 years at major pharma company. Led teams bringing two drugs to market. Focused on scientific innovation and commercial viability. Well-compensated."
person_048,"Homeless outreach worker providing street medicine. 6 years connecting unhoused individuals with services and housing. Works for city-funded program. On call 24/7. Passionate about ending homelessness."
person_049,"Equity analyst covering tech stocks for investment bank. 10 years publishing research and making buy/sell recommendations. Focused on identifying alpha for institutional clients. High-pressure, high-pay role."
person_050,"Land conservation specialist protecting ecosystems. 12 years working for land trust acquiring and managing preserves. Protected 50K+ acres of habitat. Balances conservation mission with donor relations."
person_051,"Business development manager at SaaS company. 8 years driving enterprise sales and revenue growth. Consistently exceeds quota. Focused on customer acquisition and expansion. Earns six-figure commissions."
person_052,"Domestic violence counselor supporting survivors. 9 years providing crisis intervention and safety planning. Works at underfunded shelter. Has helped 1000+ women escape abuse. Emotionally demanding but fulfilling work."
person_053,"Tax accountant optimizing corporate tax strategies. 15 years helping companies minimize tax burden legally. Partner at Big Four firm. Focused on technical excellence and client service. Bills $800/hour."
person_054,"Sustainable agriculture advocate promoting organic farming. 10 years training farmers in regenerative practices. Works for environmental nonprofit. Passionate about food systems change and soil health."
person_055,"Mergers and acquisitions specialist facilitating corporate deals. 12 years at investment bank advising on billions in transactions. Focused on shareholder value creation. Recently closed $2B acquisition."
person_056,"Gender equality researcher studying pay gaps and discrimination. 8 years publishing research on workplace inequality. Works at university. Research has informed equal pay legislation in three states."
person_057,"Credit risk analyst at commercial bank. 11 years assessing loan default probability and portfolio risk. Focused on protecting bank's balance sheet. Plays key role in lending decisions."
person_058,"Human trafficking prosecutor putting traffickers behind bars. 7 years at district attorney's office. Has secured 50+ convictions. Passionate about victim justice. Could earn more in private practice."
person_059,"Wealth management advisor building investment portfolios for affluent clients. 14 years focused on growth and income. Assets under advisement at $75M. Earns substantial commissions and fees."
person_060,"Water rights activist fighting for indigenous communities. 10 years organizing protests, filing lawsuits, raising awareness. Works with indigenous-led nonprofit. Committed to environmental and social justice despite personal sacrifice."
